No.     Time           Source                Destination           Protocol Info
   1568 7.590795       127.0.0.1             127.0.0.1             HTTP/JSON POST /connector/ping HTTP/1.1 , JavaScript Object Notation (application/json)

Frame 1568: 560 bytes on wire (4480 bits), 560 bytes captured (4480 bits) on interface \Device\NPF_Loopback, id 0
    Section number: 1
    Interface id: 0 (\Device\NPF_Loopback)
        Interface name: \Device\NPF_Loopback
    Encapsulation type: NULL/Loopback (15)
    Arrival Time: Jun 16, 2023 14:35:02.511971000 Mitteleuropäische Sommerzeit
    [Time shift for this packet: 0.000000000 seconds]
    Epoch Time: 1686918902.511971000 seconds
    [Time delta from previous captured frame: 0.000040000 seconds]
    [Time delta from previous displayed frame: 0.000000000 seconds]
    [Time since reference or first frame: 7.590795000 seconds]
    Frame Number: 1568
    Frame Length: 560 bytes (4480 bits)
    Capture Length: 560 bytes (4480 bits)
    [Frame is marked: False]
    [Frame is ignored: False]
    [Protocols in frame: null:ip:tcp:http:json]
    [Coloring Rule Name: HTTP]
    [Coloring Rule String: http || tcp.port == 80 || http2]
Null/Loopback
    Family: IP (2)
Internet Protocol Version 4, Src: 127.0.0.1, Dst: 127.0.0.1
    0100 .... = Version: 4
    .... 0101 = Header Length: 20 bytes (5)
    Differentiated Services Field: 0x00 (DSCP: CS0, ECN: Not-ECT)
        0000 00.. = Differentiated Services Codepoint: Default (0)
        .... ..00 = Explicit Congestion Notification: Not ECN-Capable Transport (0)
    Total Length: 556
    Identification: 0xfb82 (64386)
    010. .... = Flags: 0x2, Don't fragment
        0... .... = Reserved bit: Not set
        .1.. .... = Don't fragment: Set
        ..0. .... = More fragments: Not set
    ...0 0000 0000 0000 = Fragment Offset: 0
    Time to Live: 128
    Protocol: TCP (6)
    Header Checksum: 0x0000 [validation disabled]
    [Header checksum status: Unverified]
    Source Address: 127.0.0.1
    Destination Address: 127.0.0.1
Transmission Control Protocol, Src Port: 50962, Dst Port: 23119, Seq: 1, Ack: 1, Len: 516
    Source Port: 50962
    Destination Port: 23119
    [Stream index: 7]
    [Conversation completeness: Complete, WITH_DATA (31)]
    [TCP Segment Len: 516]
    Sequence Number: 1    (relative sequence number)
    Sequence Number (raw): 388824183
    [Next Sequence Number: 517    (relative sequence number)]
    Acknowledgment Number: 1    (relative ack number)
    Acknowledgment number (raw): 571725771
    0101 .... = Header Length: 20 bytes (5)
    Flags: 0x018 (PSH, ACK)
        000. .... .... = Reserved: Not set
        ...0 .... .... = Accurate ECN: Not set
        .... 0... .... = Congestion Window Reduced: Not set
        .... .0.. .... = ECN-Echo: Not set
        .... ..0. .... = Urgent: Not set
        .... ...1 .... = Acknowledgment: Set
        .... .... 1... = Push: Set
        .... .... .0.. = Reset: Not set
        .... .... ..0. = Syn: Not set
        .... .... ...0 = Fin: Not set
        [TCP Flags: ·······AP···]
    Window: 8442
    [Calculated window size: 2161152]
    [Window size scaling factor: 256]
    Checksum: 0xb2ac [unverified]
    [Checksum Status: Unverified]
    Urgent Pointer: 0
    [Timestamps]
        [Time since first frame in this TCP stream: 0.000577000 seconds]
        [Time since previous frame in this TCP stream: 0.000402000 seconds]
    [SEQ/ACK analysis]
        [iRTT: 0.000175000 seconds]
        [Bytes in flight: 516]
        [Bytes sent since last PSH flag: 516]
    TCP payload (516 bytes)
Hypertext Transfer Protocol
    POST /connector/ping HTTP/1.1\r\n
        [Expert Info (Chat/Sequence): POST /connector/ping HTTP/1.1\r\n]
            [POST /connector/ping HTTP/1.1\r\n]
            [Severity level: Chat]
            [Group: Sequence]
        Request Method: POST
        Request URI: /connector/ping
        Request Version: HTTP/1.1
    Host: 127.0.0.1:23119\r\n
    User-Agent: Mozilla/5.0 (Windows NT 10.0; Win64; x64; rv:109.0) Gecko/20100101 Firefox/114.0\r\n
    Accept: */*\r\n
    Accept-Language: de,en-US;q=0.7,en;q=0.3\r\n
    Accept-Encoding: gzip, deflate, br\r\n
    content-type: application/json\r\n
    x-zotero-connector-api-version: 2\r\n
    x-zotero-version: 5.0.108\r\n
    Content-Length: 2\r\n
        [Content length: 2]
    Origin: moz-extension://97b09d9d-ea60-42fe-a868-9a32398d4b37\r\n
    Connection: keep-alive\r\n
    Sec-Fetch-Dest: empty\r\n
    Sec-Fetch-Mode: cors\r\n
    Sec-Fetch-Site: same-origin\r\n
    \r\n
    [Full request URI: http://127.0.0.1:23119/connector/ping]
    [HTTP request 1/1]
    [Response in frame: 1624]
    File Data: 2 bytes
JavaScript Object Notation: application/json
    Object

No.     Time           Source                Destination           Protocol Info
   1624 7.594598       127.0.0.1             127.0.0.1             HTTP/JSON HTTP/1.0 200 OK , JavaScript Object Notation (application/json)

Frame 1624: 44 bytes on wire (352 bits), 44 bytes captured (352 bits) on interface \Device\NPF_Loopback, id 0
    Section number: 1
    Interface id: 0 (\Device\NPF_Loopback)
        Interface name: \Device\NPF_Loopback
    Encapsulation type: NULL/Loopback (15)
    Arrival Time: Jun 16, 2023 14:35:02.515774000 Mitteleuropäische Sommerzeit
    [Time shift for this packet: 0.000000000 seconds]
    Epoch Time: 1686918902.515774000 seconds
    [Time delta from previous captured frame: 0.000032000 seconds]
    [Time delta from previous displayed frame: 0.003803000 seconds]
    [Time since reference or first frame: 7.594598000 seconds]
    Frame Number: 1624
    Frame Length: 44 bytes (352 bits)
    Capture Length: 44 bytes (352 bits)
    [Frame is marked: False]
    [Frame is ignored: False]
    [Protocols in frame: null:ip:tcp:http:json]
    [Coloring Rule Name: HTTP]
    [Coloring Rule String: http || tcp.port == 80 || http2]
Null/Loopback
    Family: IP (2)
Internet Protocol Version 4, Src: 127.0.0.1, Dst: 127.0.0.1
    0100 .... = Version: 4
    .... 0101 = Header Length: 20 bytes (5)
    Differentiated Services Field: 0x00 (DSCP: CS0, ECN: Not-ECT)
        0000 00.. = Differentiated Services Codepoint: Default (0)
        .... ..00 = Explicit Congestion Notification: Not ECN-Capable Transport (0)
    Total Length: 40
    Identification: 0xfbba (64442)
    010. .... = Flags: 0x2, Don't fragment
        0... .... = Reserved bit: Not set
        .1.. .... = Don't fragment: Set
        ..0. .... = More fragments: Not set
    ...0 0000 0000 0000 = Fragment Offset: 0
    Time to Live: 128
    Protocol: TCP (6)
    Header Checksum: 0x0000 [validation disabled]
    [Header checksum status: Unverified]
    Source Address: 127.0.0.1
    Destination Address: 127.0.0.1
Transmission Control Protocol, Src Port: 23119, Dst Port: 50962, Seq: 182, Ack: 517, Len: 0
    Source Port: 23119
    Destination Port: 50962
    [Stream index: 7]
    [Conversation completeness: Complete, WITH_DATA (31)]
    [TCP Segment Len: 0]
    Sequence Number: 182    (relative sequence number)
    Sequence Number (raw): 571725952
    [Next Sequence Number: 183    (relative sequence number)]
    Acknowledgment Number: 517    (relative ack number)
    Acknowledgment number (raw): 388824699
    0101 .... = Header Length: 20 bytes (5)
    Flags: 0x011 (FIN, ACK)
        000. .... .... = Reserved: Not set
        ...0 .... .... = Accurate ECN: Not set
        .... 0... .... = Congestion Window Reduced: Not set
        .... .0.. .... = ECN-Echo: Not set
        .... ..0. .... = Urgent: Not set
        .... ...1 .... = Acknowledgment: Set
        .... .... 0... = Push: Not set
        .... .... .0.. = Reset: Not set
        .... .... ..0. = Syn: Not set
        .... .... ...1 = Fin: Set
            [Expert Info (Chat/Sequence): Connection finish (FIN)]
                [Connection finish (FIN)]
                [Severity level: Chat]
                [Group: Sequence]
        [TCP Flags: ·······A···F]
            [Expert Info (Note/Sequence): This frame initiates the connection closing]
                [This frame initiates the connection closing]
                [Severity level: Note]
                [Group: Sequence]
    Window: 8440
    [Calculated window size: 2160640]
    [Window size scaling factor: 256]
    Checksum: 0x5f3b [unverified]
    [Checksum Status: Unverified]
    Urgent Pointer: 0
    [Timestamps]
        [Time since first frame in this TCP stream: 0.004380000 seconds]
        [Time since previous frame in this TCP stream: 0.000072000 seconds]
[2 Reassembled TCP Segments (181 bytes): #1620(181), #1624(0)]
    [Frame: 1620, payload: 0-180 (181 bytes)]
    [Frame: 1624 (no data)]
    [Segment count: 2]
    [Reassembled TCP length: 181]
    [Reassembled TCP Data: 485454502f312e3020323030204f4b0d0a582d5a6f7465726f2d56657273696f6e3a2036…]
Hypertext Transfer Protocol
    HTTP/1.0 200 OK\r\n
        [Expert Info (Chat/Sequence): HTTP/1.0 200 OK\r\n]
            [HTTP/1.0 200 OK\r\n]
            [Severity level: Chat]
            [Group: Sequence]
        Response Version: HTTP/1.0
        Status Code: 200
        [Status Code Description: OK]
        Response Phrase: OK
    X-Zotero-Version: 6.0.26\r\n
    X-Zotero-Connector-API-Version: 2\r\n
    Content-Type: application/json\r\n
    \r\n
    [HTTP response 1/1]
    [Time since request: 0.003803000 seconds]
    [Request in frame: 1568]
    [Request URI: http://127.0.0.1:23119/connector/ping]
    File Data: 69 bytes
JavaScript Object Notation: application/json
    Object
        Member: prefs
            Object
                Member: automaticSnapshots
                    [Path with value: /prefs/automaticSnapshots:true]
                    [Member with value: automaticSnapshots:true]
                    True value
                    Key: automaticSnapshots
                    [Path: /prefs/automaticSnapshots]
                Member: googleDocsAddNoteEnabled
                    [Path with value: /prefs/googleDocsAddNoteEnabled:true]
                    [Member with value: googleDocsAddNoteEnabled:true]
                    True value
                    Key: googleDocsAddNoteEnabled
                    [Path: /prefs/googleDocsAddNoteEnabled]
            Key: prefs
            [Path: /prefs]

No.     Time           Source                Destination           Protocol Info
   3909 17.365155      127.0.0.1             127.0.0.1             HTTP     GET /listteas HTTP/1.1 

Frame 3909: 606 bytes on wire (4848 bits), 606 bytes captured (4848 bits) on interface \Device\NPF_Loopback, id 0
    Section number: 1
    Interface id: 0 (\Device\NPF_Loopback)
        Interface name: \Device\NPF_Loopback
    Encapsulation type: NULL/Loopback (15)
    Arrival Time: Jun 16, 2023 14:35:12.286331000 Mitteleuropäische Sommerzeit
    [Time shift for this packet: 0.000000000 seconds]
    Epoch Time: 1686918912.286331000 seconds
    [Time delta from previous captured frame: 0.000282000 seconds]
    [Time delta from previous displayed frame: 9.770557000 seconds]
    [Time since reference or first frame: 17.365155000 seconds]
    Frame Number: 3909
    Frame Length: 606 bytes (4848 bits)
    Capture Length: 606 bytes (4848 bits)
    [Frame is marked: False]
    [Frame is ignored: False]
    [Protocols in frame: null:ip:tcp:http]
    [Coloring Rule Name: HTTP]
    [Coloring Rule String: http || tcp.port == 80 || http2]
Null/Loopback
    Family: IP (2)
Internet Protocol Version 4, Src: 127.0.0.1, Dst: 127.0.0.1
    0100 .... = Version: 4
    .... 0101 = Header Length: 20 bytes (5)
    Differentiated Services Field: 0x00 (DSCP: CS0, ECN: Not-ECT)
        0000 00.. = Differentiated Services Codepoint: Default (0)
        .... ..00 = Explicit Congestion Notification: Not ECN-Capable Transport (0)
    Total Length: 602
    Identification: 0x0495 (1173)
    010. .... = Flags: 0x2, Don't fragment
        0... .... = Reserved bit: Not set
        .1.. .... = Don't fragment: Set
        ..0. .... = More fragments: Not set
    ...0 0000 0000 0000 = Fragment Offset: 0
    Time to Live: 128
    Protocol: TCP (6)
    Header Checksum: 0x0000 [validation disabled]
    [Header checksum status: Unverified]
    Source Address: 127.0.0.1
    Destination Address: 127.0.0.1
Transmission Control Protocol, Src Port: 50965, Dst Port: 8181, Seq: 1, Ack: 1, Len: 562
    Source Port: 50965
    Destination Port: 8181
    [Stream index: 10]
    [Conversation completeness: Incomplete, DATA (15)]
    [TCP Segment Len: 562]
    Sequence Number: 1    (relative sequence number)
    Sequence Number (raw): 4121386004
    [Next Sequence Number: 563    (relative sequence number)]
    Acknowledgment Number: 1    (relative ack number)
    Acknowledgment number (raw): 3914124191
    0101 .... = Header Length: 20 bytes (5)
    Flags: 0x018 (PSH, ACK)
        000. .... .... = Reserved: Not set
        ...0 .... .... = Accurate ECN: Not set
        .... 0... .... = Congestion Window Reduced: Not set
        .... .0.. .... = ECN-Echo: Not set
        .... ..0. .... = Urgent: Not set
        .... ...1 .... = Acknowledgment: Set
        .... .... 1... = Push: Set
        .... .... .0.. = Reset: Not set
        .... .... ..0. = Syn: Not set
        .... .... ...0 = Fin: Not set
        [TCP Flags: ·······AP···]
    Window: 8442
    [Calculated window size: 2161152]
    [Window size scaling factor: 256]
    Checksum: 0x5061 [unverified]
    [Checksum Status: Unverified]
    Urgent Pointer: 0
    [Timestamps]
        [Time since first frame in this TCP stream: 0.000486000 seconds]
        [Time since previous frame in this TCP stream: 0.000282000 seconds]
    [SEQ/ACK analysis]
        [iRTT: 0.000204000 seconds]
        [Bytes in flight: 562]
        [Bytes sent since last PSH flag: 562]
    TCP payload (562 bytes)
Hypertext Transfer Protocol
    GET /listteas HTTP/1.1\r\n
        [Expert Info (Chat/Sequence): GET /listteas HTTP/1.1\r\n]
            [GET /listteas HTTP/1.1\r\n]
            [Severity level: Chat]
            [Group: Sequence]
        Request Method: GET
        Request URI: /listteas
        Request Version: HTTP/1.1
    Host: localhost:8181\r\n
    User-Agent: Mozilla/5.0 (Windows NT 10.0; Win64; x64; rv:109.0) Gecko/20100101 Firefox/114.0\r\n
    Accept: text/html,application/xhtml+xml,application/xml;q=0.9,image/avif,image/webp,*/*;q=0.8\r\n
    Accept-Language: de,en-US;q=0.7,en;q=0.3\r\n
    Accept-Encoding: gzip, deflate, br\r\n
    Connection: keep-alive\r\n
    Cookie: SESSION=29b677f9-df2f-43e0-96be-a7de6ff128ea; JSESSIONID=C247089CF0949EEAAC9EE78DD849D8B2\r\n
        Cookie pair: SESSION=29b677f9-df2f-43e0-96be-a7de6ff128ea
        Cookie pair: JSESSIONID=C247089CF0949EEAAC9EE78DD849D8B2
    Upgrade-Insecure-Requests: 1\r\n
    Sec-Fetch-Dest: document\r\n
    Sec-Fetch-Mode: navigate\r\n
    Sec-Fetch-Site: none\r\n
    Sec-Fetch-User: ?1\r\n
    \r\n
    [Full request URI: http://localhost:8181/listteas]
    [HTTP request 1/4]
    [Response in frame: 3973]
    [Next request in frame: 3991]

No.     Time           Source                Destination           Protocol Info
   3973 17.579170      127.0.0.1             127.0.0.1             HTTP     HTTP/1.1 302 Found 

Frame 3973: 432 bytes on wire (3456 bits), 432 bytes captured (3456 bits) on interface \Device\NPF_Loopback, id 0
    Section number: 1
    Interface id: 0 (\Device\NPF_Loopback)
        Interface name: \Device\NPF_Loopback
    Encapsulation type: NULL/Loopback (15)
    Arrival Time: Jun 16, 2023 14:35:12.500346000 Mitteleuropäische Sommerzeit
    [Time shift for this packet: 0.000000000 seconds]
    Epoch Time: 1686918912.500346000 seconds
    [Time delta from previous captured frame: 0.013295000 seconds]
    [Time delta from previous displayed frame: 0.214015000 seconds]
    [Time since reference or first frame: 17.579170000 seconds]
    Frame Number: 3973
    Frame Length: 432 bytes (3456 bits)
    Capture Length: 432 bytes (3456 bits)
    [Frame is marked: False]
    [Frame is ignored: False]
    [Protocols in frame: null:ip:tcp:http]
    [Coloring Rule Name: HTTP]
    [Coloring Rule String: http || tcp.port == 80 || http2]
Null/Loopback
    Family: IP (2)
Internet Protocol Version 4, Src: 127.0.0.1, Dst: 127.0.0.1
    0100 .... = Version: 4
    .... 0101 = Header Length: 20 bytes (5)
    Differentiated Services Field: 0x00 (DSCP: CS0, ECN: Not-ECT)
        0000 00.. = Differentiated Services Codepoint: Default (0)
        .... ..00 = Explicit Congestion Notification: Not ECN-Capable Transport (0)
    Total Length: 428
    Identification: 0x04d5 (1237)
    010. .... = Flags: 0x2, Don't fragment
        0... .... = Reserved bit: Not set
        .1.. .... = Don't fragment: Set
        ..0. .... = More fragments: Not set
    ...0 0000 0000 0000 = Fragment Offset: 0
    Time to Live: 128
    Protocol: TCP (6)
    Header Checksum: 0x0000 [validation disabled]
    [Header checksum status: Unverified]
    Source Address: 127.0.0.1
    Destination Address: 127.0.0.1
Transmission Control Protocol, Src Port: 8181, Dst Port: 50965, Seq: 1, Ack: 563, Len: 388
    Source Port: 8181
    Destination Port: 50965
    [Stream index: 10]
    [Conversation completeness: Incomplete, DATA (15)]
    [TCP Segment Len: 388]
    Sequence Number: 1    (relative sequence number)
    Sequence Number (raw): 3914124191
    [Next Sequence Number: 389    (relative sequence number)]
    Acknowledgment Number: 563    (relative ack number)
    Acknowledgment number (raw): 4121386566
    0101 .... = Header Length: 20 bytes (5)
    Flags: 0x018 (PSH, ACK)
        000. .... .... = Reserved: Not set
        ...0 .... .... = Accurate ECN: Not set
        .... 0... .... = Congestion Window Reduced: Not set
        .... .0.. .... = ECN-Echo: Not set
        .... ..0. .... = Urgent: Not set
        .... ...1 .... = Acknowledgment: Set
        .... .... 1... = Push: Set
        .... .... .0.. = Reset: Not set
        .... .... ..0. = Syn: Not set
        .... .... ...0 = Fin: Not set
        [TCP Flags: ·······AP···]
    Window: 8440
    [Calculated window size: 2160640]
    [Window size scaling factor: 256]
    Checksum: 0x95fa [unverified]
    [Checksum Status: Unverified]
    Urgent Pointer: 0
    [Timestamps]
        [Time since first frame in this TCP stream: 0.214501000 seconds]
        [Time since previous frame in this TCP stream: 0.213979000 seconds]
    [SEQ/ACK analysis]
        [iRTT: 0.000204000 seconds]
        [Bytes in flight: 388]
        [Bytes sent since last PSH flag: 388]
    TCP payload (388 bytes)
Hypertext Transfer Protocol
    HTTP/1.1 302 Found\r\n
        [Expert Info (Chat/Sequence): HTTP/1.1 302 Found\r\n]
            [HTTP/1.1 302 Found\r\n]
            [Severity level: Chat]
            [Group: Sequence]
        Response Version: HTTP/1.1
        Status Code: 302
        [Status Code Description: Found]
        Response Phrase: Found
    Location: /oauth2/authorization/keycloak-gateway-client\r\n
    Cache-Control: no-cache, no-store, max-age=0, must-revalidate\r\n
    Pragma: no-cache\r\n
    Expires: 0\r\n
    X-Content-Type-Options: nosniff\r\n
    X-Frame-Options: DENY\r\n
    X-XSS-Protection: 0\r\n
    Referrer-Policy: no-referrer\r\n
    Set-Cookie: SESSION=90e6a574-c7e3-4b3a-bda8-6289733c84f2; Path=/; HttpOnly; SameSite=Lax\r\n
    content-length: 0\r\n
        [Content length: 0]
    \r\n
    [HTTP response 1/4]
    [Time since request: 0.214015000 seconds]
    [Request in frame: 3909]
    [Next request in frame: 3991]
    [Next response in frame: 3997]
    [Request URI: http://localhost:8181/listteas]

No.     Time           Source                Destination           Protocol Info
   3991 17.587024      127.0.0.1             127.0.0.1             HTTP     GET /oauth2/authorization/keycloak-gateway-client HTTP/1.1 

Frame 3991: 642 bytes on wire (5136 bits), 642 bytes captured (5136 bits) on interface \Device\NPF_Loopback, id 0
    Section number: 1
    Interface id: 0 (\Device\NPF_Loopback)
        Interface name: \Device\NPF_Loopback
    Encapsulation type: NULL/Loopback (15)
    Arrival Time: Jun 16, 2023 14:35:12.508200000 Mitteleuropäische Sommerzeit
    [Time shift for this packet: 0.000000000 seconds]
    Epoch Time: 1686918912.508200000 seconds
    [Time delta from previous captured frame: 0.000076000 seconds]
    [Time delta from previous displayed frame: 0.007854000 seconds]
    [Time since reference or first frame: 17.587024000 seconds]
    Frame Number: 3991
    Frame Length: 642 bytes (5136 bits)
    Capture Length: 642 bytes (5136 bits)
    [Frame is marked: False]
    [Frame is ignored: False]
    [Protocols in frame: null:ip:tcp:http]
    [Coloring Rule Name: HTTP]
    [Coloring Rule String: http || tcp.port == 80 || http2]
Null/Loopback
    Family: IP (2)
Internet Protocol Version 4, Src: 127.0.0.1, Dst: 127.0.0.1
    0100 .... = Version: 4
    .... 0101 = Header Length: 20 bytes (5)
    Differentiated Services Field: 0x00 (DSCP: CS0, ECN: Not-ECT)
        0000 00.. = Differentiated Services Codepoint: Default (0)
        .... ..00 = Explicit Congestion Notification: Not ECN-Capable Transport (0)
    Total Length: 638
    Identification: 0x04e7 (1255)
    010. .... = Flags: 0x2, Don't fragment
        0... .... = Reserved bit: Not set
        .1.. .... = Don't fragment: Set
        ..0. .... = More fragments: Not set
    ...0 0000 0000 0000 = Fragment Offset: 0
    Time to Live: 128
    Protocol: TCP (6)
    Header Checksum: 0x0000 [validation disabled]
    [Header checksum status: Unverified]
    Source Address: 127.0.0.1
    Destination Address: 127.0.0.1
Transmission Control Protocol, Src Port: 50965, Dst Port: 8181, Seq: 563, Ack: 389, Len: 598
    Source Port: 50965
    Destination Port: 8181
    [Stream index: 10]
    [Conversation completeness: Incomplete, DATA (15)]
    [TCP Segment Len: 598]
    Sequence Number: 563    (relative sequence number)
    Sequence Number (raw): 4121386566
    [Next Sequence Number: 1161    (relative sequence number)]
    Acknowledgment Number: 389    (relative ack number)
    Acknowledgment number (raw): 3914124579
    0101 .... = Header Length: 20 bytes (5)
    Flags: 0x018 (PSH, ACK)
        000. .... .... = Reserved: Not set
        ...0 .... .... = Accurate ECN: Not set
        .... 0... .... = Congestion Window Reduced: Not set
        .... .0.. .... = ECN-Echo: Not set
        .... ..0. .... = Urgent: Not set
        .... ...1 .... = Acknowledgment: Set
        .... .... 1... = Push: Set
        .... .... .0.. = Reset: Not set
        .... .... ..0. = Syn: Not set
        .... .... ...0 = Fin: Not set
        [TCP Flags: ·······AP···]
    Window: 8441
    [Calculated window size: 2160896]
    [Window size scaling factor: 256]
    Checksum: 0x5348 [unverified]
    [Checksum Status: Unverified]
    Urgent Pointer: 0
    [Timestamps]
        [Time since first frame in this TCP stream: 0.222355000 seconds]
        [Time since previous frame in this TCP stream: 0.007807000 seconds]
    [SEQ/ACK analysis]
        [iRTT: 0.000204000 seconds]
        [Bytes in flight: 598]
        [Bytes sent since last PSH flag: 598]
    TCP payload (598 bytes)
Hypertext Transfer Protocol
    GET /oauth2/authorization/keycloak-gateway-client HTTP/1.1\r\n
        [Expert Info (Chat/Sequence): GET /oauth2/authorization/keycloak-gateway-client HTTP/1.1\r\n]
            [GET /oauth2/authorization/keycloak-gateway-client HTTP/1.1\r\n]
            [Severity level: Chat]
            [Group: Sequence]
        Request Method: GET
        Request URI: /oauth2/authorization/keycloak-gateway-client
        Request Version: HTTP/1.1
    Host: localhost:8181\r\n
    User-Agent: Mozilla/5.0 (Windows NT 10.0; Win64; x64; rv:109.0) Gecko/20100101 Firefox/114.0\r\n
    Accept: text/html,application/xhtml+xml,application/xml;q=0.9,image/avif,image/webp,*/*;q=0.8\r\n
    Accept-Language: de,en-US;q=0.7,en;q=0.3\r\n
    Accept-Encoding: gzip, deflate, br\r\n
    Connection: keep-alive\r\n
    Cookie: SESSION=90e6a574-c7e3-4b3a-bda8-6289733c84f2; JSESSIONID=C247089CF0949EEAAC9EE78DD849D8B2\r\n
        Cookie pair: SESSION=90e6a574-c7e3-4b3a-bda8-6289733c84f2
        Cookie pair: JSESSIONID=C247089CF0949EEAAC9EE78DD849D8B2
    Upgrade-Insecure-Requests: 1\r\n
    Sec-Fetch-Dest: document\r\n
    Sec-Fetch-Mode: navigate\r\n
    Sec-Fetch-Site: none\r\n
    Sec-Fetch-User: ?1\r\n
    \r\n
    [Full request URI: http://localhost:8181/oauth2/authorization/keycloak-gateway-client]
    [HTTP request 2/4]
    [Prev request in frame: 3909]
    [Response in frame: 3997]
    [Next request in frame: 5927]

No.     Time           Source                Destination           Protocol Info
   3997 17.605562      127.0.0.1             127.0.0.1             HTTP     HTTP/1.1 302 Found 

Frame 3997: 610 bytes on wire (4880 bits), 610 bytes captured (4880 bits) on interface \Device\NPF_Loopback, id 0
    Section number: 1
    Interface id: 0 (\Device\NPF_Loopback)
        Interface name: \Device\NPF_Loopback
    Encapsulation type: NULL/Loopback (15)
    Arrival Time: Jun 16, 2023 14:35:12.526738000 Mitteleuropäische Sommerzeit
    [Time shift for this packet: 0.000000000 seconds]
    Epoch Time: 1686918912.526738000 seconds
    [Time delta from previous captured frame: 0.017241000 seconds]
    [Time delta from previous displayed frame: 0.018538000 seconds]
    [Time since reference or first frame: 17.605562000 seconds]
    Frame Number: 3997
    Frame Length: 610 bytes (4880 bits)
    Capture Length: 610 bytes (4880 bits)
    [Frame is marked: False]
    [Frame is ignored: False]
    [Protocols in frame: null:ip:tcp:http]
    [Coloring Rule Name: HTTP]
    [Coloring Rule String: http || tcp.port == 80 || http2]
Null/Loopback
    Family: IP (2)
Internet Protocol Version 4, Src: 127.0.0.1, Dst: 127.0.0.1
    0100 .... = Version: 4
    .... 0101 = Header Length: 20 bytes (5)
    Differentiated Services Field: 0x00 (DSCP: CS0, ECN: Not-ECT)
        0000 00.. = Differentiated Services Codepoint: Default (0)
        .... ..00 = Explicit Congestion Notification: Not ECN-Capable Transport (0)
    Total Length: 606
    Identification: 0x04ed (1261)
    010. .... = Flags: 0x2, Don't fragment
        0... .... = Reserved bit: Not set
        .1.. .... = Don't fragment: Set
        ..0. .... = More fragments: Not set
    ...0 0000 0000 0000 = Fragment Offset: 0
    Time to Live: 128
    Protocol: TCP (6)
    Header Checksum: 0x0000 [validation disabled]
    [Header checksum status: Unverified]
    Source Address: 127.0.0.1
    Destination Address: 127.0.0.1
Transmission Control Protocol, Src Port: 8181, Dst Port: 50965, Seq: 389, Ack: 1161, Len: 566
    Source Port: 8181
    Destination Port: 50965
    [Stream index: 10]
    [Conversation completeness: Incomplete, DATA (15)]
    [TCP Segment Len: 566]
    Sequence Number: 389    (relative sequence number)
    Sequence Number (raw): 3914124579
    [Next Sequence Number: 955    (relative sequence number)]
    Acknowledgment Number: 1161    (relative ack number)
    Acknowledgment number (raw): 4121387164
    0101 .... = Header Length: 20 bytes (5)
    Flags: 0x018 (PSH, ACK)
        000. .... .... = Reserved: Not set
        ...0 .... .... = Accurate ECN: Not set
        .... 0... .... = Congestion Window Reduced: Not set
        .... .0.. .... = ECN-Echo: Not set
        .... ..0. .... = Urgent: Not set
        .... ...1 .... = Acknowledgment: Set
        .... .... 1... = Push: Set
        .... .... .0.. = Reset: Not set
        .... .... ..0. = Syn: Not set
        .... .... ...0 = Fin: Not set
        [TCP Flags: ·······AP···]
    Window: 8438
    [Calculated window size: 2160128]
    [Window size scaling factor: 256]
    Checksum: 0xb712 [unverified]
    [Checksum Status: Unverified]
    Urgent Pointer: 0
    [Timestamps]
        [Time since first frame in this TCP stream: 0.240893000 seconds]
        [Time since previous frame in this TCP stream: 0.018502000 seconds]
    [SEQ/ACK analysis]
        [iRTT: 0.000204000 seconds]
        [Bytes in flight: 566]
        [Bytes sent since last PSH flag: 566]
    TCP payload (566 bytes)
Hypertext Transfer Protocol
    HTTP/1.1 302 Found\r\n
        [Expert Info (Chat/Sequence): HTTP/1.1 302 Found\r\n]
            [HTTP/1.1 302 Found\r\n]
            [Severity level: Chat]
            [Group: Sequence]
        Response Version: HTTP/1.1
        Status Code: 302
        [Status Code Description: Found]
        Response Phrase: Found
     [truncated]Location: http://host.docker.internal:10001/realms/teapot/protocol/openid-connect/auth?response_type=code&client_id=teapot-gateway&scope=openid&state=FczD4rvwKxMMyYRC0joaa-oAr-GMbaG2rbuW76gE72k%3D&redirect_uri=http://localhost
    Cache-Control: no-cache, no-store, max-age=0, must-revalidate\r\n
    Pragma: no-cache\r\n
    Expires: 0\r\n
    X-Content-Type-Options: nosniff\r\n
    X-Frame-Options: DENY\r\n
    X-XSS-Protection: 0\r\n
    Referrer-Policy: no-referrer\r\n
    content-length: 0\r\n
        [Content length: 0]
    \r\n
    [HTTP response 2/4]
    [Time since request: 0.018538000 seconds]
    [Prev request in frame: 3909]
    [Prev response in frame: 3973]
    [Request in frame: 3991]
    [Next request in frame: 5927]
    [Next response in frame: 6033]
    [Request URI: http://localhost:8181/oauth2/authorization/keycloak-gateway-client]

No.     Time           Source                Destination           Protocol Info
   4060 17.624525      127.0.0.1             127.0.0.1             HTTP     GET /realms/teapot/protocol/openid-connect/auth?response_type=code&client_id=teapot-gateway&scope=openid&state=FczD4rvwKxMMyYRC0joaa-oAr-GMbaG2rbuW76gE72k%3D&redirect_uri=http://localhost:8181/login/oauth2/code/keycloak-gateway-client&nonce=BVUZ0gzd1P-FjEqiFWv8gLspnEEdaOpvvqm3hgiAriI HTTP/1.1 

Frame 4060: 692 bytes on wire (5536 bits), 692 bytes captured (5536 bits) on interface \Device\NPF_Loopback, id 0
    Section number: 1
    Interface id: 0 (\Device\NPF_Loopback)
        Interface name: \Device\NPF_Loopback
    Encapsulation type: NULL/Loopback (15)
    Arrival Time: Jun 16, 2023 14:35:12.545701000 Mitteleuropäische Sommerzeit
    [Time shift for this packet: 0.000000000 seconds]
    Epoch Time: 1686918912.545701000 seconds
    [Time delta from previous captured frame: 0.000137000 seconds]
    [Time delta from previous displayed frame: 0.018963000 seconds]
    [Time since reference or first frame: 17.624525000 seconds]
    Frame Number: 4060
    Frame Length: 692 bytes (5536 bits)
    Capture Length: 692 bytes (5536 bits)
    [Frame is marked: False]
    [Frame is ignored: False]
    [Protocols in frame: null:ip:tcp:http]
    [Coloring Rule Name: HTTP]
    [Coloring Rule String: http || tcp.port == 80 || http2]
Null/Loopback
    Family: IP (2)
Internet Protocol Version 4, Src: 127.0.0.1, Dst: 127.0.0.1
    0100 .... = Version: 4
    .... 0101 = Header Length: 20 bytes (5)
    Differentiated Services Field: 0x00 (DSCP: CS0, ECN: Not-ECT)
        0000 00.. = Differentiated Services Codepoint: Default (0)
        .... ..00 = Explicit Congestion Notification: Not ECN-Capable Transport (0)
    Total Length: 688
    Identification: 0x052c (1324)
    010. .... = Flags: 0x2, Don't fragment
        0... .... = Reserved bit: Not set
        .1.. .... = Don't fragment: Set
        ..0. .... = More fragments: Not set
    ...0 0000 0000 0000 = Fragment Offset: 0
    Time to Live: 128
    Protocol: TCP (6)
    Header Checksum: 0x0000 [validation disabled]
    [Header checksum status: Unverified]
    Source Address: 127.0.0.1
    Destination Address: 127.0.0.1
Transmission Control Protocol, Src Port: 50966, Dst Port: 10001, Seq: 1, Ack: 1, Len: 648
    Source Port: 50966
    Destination Port: 10001
    [Stream index: 11]
    [Conversation completeness: Incomplete, DATA (15)]
    [TCP Segment Len: 648]
    Sequence Number: 1    (relative sequence number)
    Sequence Number (raw): 3163439439
    [Next Sequence Number: 649    (relative sequence number)]
    Acknowledgment Number: 1    (relative ack number)
    Acknowledgment number (raw): 3670947607
    0101 .... = Header Length: 20 bytes (5)
    Flags: 0x018 (PSH, ACK)
        000. .... .... = Reserved: Not set
        ...0 .... .... = Accurate ECN: Not set
        .... 0... .... = Congestion Window Reduced: Not set
        .... .0.. .... = ECN-Echo: Not set
        .... ..0. .... = Urgent: Not set
        .... ...1 .... = Acknowledgment: Set
        .... .... 1... = Push: Set
        .... .... .0.. = Reset: Not set
        .... .... ..0. = Syn: Not set
        .... .... ...0 = Fin: Not set
        [TCP Flags: ·······AP···]
    Window: 8442
    [Calculated window size: 2161152]
    [Window size scaling factor: 256]
    Checksum: 0x4f0b [unverified]
    [Checksum Status: Unverified]
    Urgent Pointer: 0
    [Timestamps]
        [Time since first frame in this TCP stream: 0.000552000 seconds]
        [Time since previous frame in this TCP stream: 0.000440000 seconds]
    [SEQ/ACK analysis]
        [iRTT: 0.000112000 seconds]
        [Bytes in flight: 648]
        [Bytes sent since last PSH flag: 648]
    TCP payload (648 bytes)
Hypertext Transfer Protocol
     [truncated]GET /realms/teapot/protocol/openid-connect/auth?response_type=code&client_id=teapot-gateway&scope=openid&state=FczD4rvwKxMMyYRC0joaa-oAr-GMbaG2rbuW76gE72k%3D&redirect_uri=http://localhost:8181/login/oauth2/code/keycloak-gatewa
        [ [truncated]Expert Info (Chat/Sequence): GET /realms/teapot/protocol/openid-connect/auth?response_type=code&client_id=teapot-gateway&scope=openid&state=FczD4rvwKxMMyYRC0joaa-oAr-GMbaG2rbuW76gE72k%3D&redirect_uri=http://localhost:8181/logi]
            [GET /realms/teapot/protocol/openid-connect/auth?response_type=code&client_id=teapot-gateway&scope=openid&state=FczD4rvwKxMMyYRC0joaa-oAr-GMbaG2rbuW76gE72k%3D&redirect_uri=http://localhost:8181/login/oauth2/code/keycloak-gateway-client&nonc]
            [Severity level: Chat]
            [Group: Sequence]
        Request Method: GET
        Request URI [truncated]: /realms/teapot/protocol/openid-connect/auth?response_type=code&client_id=teapot-gateway&scope=openid&state=FczD4rvwKxMMyYRC0joaa-oAr-GMbaG2rbuW76gE72k%3D&redirect_uri=http://localhost:8181/login/oauth2/code/keyclo
            Request URI Path: /realms/teapot/protocol/openid-connect/auth
            Request URI Query [truncated]: response_type=code&client_id=teapot-gateway&scope=openid&state=FczD4rvwKxMMyYRC0joaa-oAr-GMbaG2rbuW76gE72k%3D&redirect_uri=http://localhost:8181/login/oauth2/code/keycloak-gateway-client&nonce=BVUZ0gzd1P-FjE
                Request URI Query Parameter: response_type=code
                Request URI Query Parameter: client_id=teapot-gateway
                Request URI Query Parameter: scope=openid
                Request URI Query Parameter: state=FczD4rvwKxMMyYRC0joaa-oAr-GMbaG2rbuW76gE72k%3D
                Request URI Query Parameter: redirect_uri=http://localhost:8181/login/oauth2/code/keycloak-gateway-client
                Request URI Query Parameter: nonce=BVUZ0gzd1P-FjEqiFWv8gLspnEEdaOpvvqm3hgiAriI
        Request Version: HTTP/1.1
    Host: host.docker.internal:10001\r\n
    User-Agent: Mozilla/5.0 (Windows NT 10.0; Win64; x64; rv:109.0) Gecko/20100101 Firefox/114.0\r\n
    Accept: text/html,application/xhtml+xml,application/xml;q=0.9,image/avif,image/webp,*/*;q=0.8\r\n
    Accept-Language: de,en-US;q=0.7,en;q=0.3\r\n
    Accept-Encoding: gzip, deflate\r\n
    Connection: keep-alive\r\n
    Upgrade-Insecure-Requests: 1\r\n
    \r\n
    [Full request URI [truncated]: http://host.docker.internal:10001/realms/teapot/protocol/openid-connect/auth?response_type=code&client_id=teapot-gateway&scope=openid&state=FczD4rvwKxMMyYRC0joaa-oAr-GMbaG2rbuW76gE72k%3D&redirect_uri=http://l]
    [HTTP request 1/2]
    [Response in frame: 4072]
    [Next request in frame: 4216]

No.     Time           Source                Destination           Protocol Info
   4072 17.709842      127.0.0.1             127.0.0.1             HTTP     HTTP/1.1 200 OK  (text/html)

Frame 4072: 4968 bytes on wire (39744 bits), 4968 bytes captured (39744 bits) on interface \Device\NPF_Loopback, id 0
    Section number: 1
    Interface id: 0 (\Device\NPF_Loopback)
        Interface name: \Device\NPF_Loopback
    Encapsulation type: NULL/Loopback (15)
    Arrival Time: Jun 16, 2023 14:35:12.631018000 Mitteleuropäische Sommerzeit
    [Time shift for this packet: 0.000000000 seconds]
    Epoch Time: 1686918912.631018000 seconds
    [Time delta from previous captured frame: 0.042109000 seconds]
    [Time delta from previous displayed frame: 0.085317000 seconds]
    [Time since reference or first frame: 17.709842000 seconds]
    Frame Number: 4072
    Frame Length: 4968 bytes (39744 bits)
    Capture Length: 4968 bytes (39744 bits)
    [Frame is marked: False]
    [Frame is ignored: False]
    [Protocols in frame: null:ip:tcp:http:data-text-lines]
    [Coloring Rule Name: HTTP]
    [Coloring Rule String: http || tcp.port == 80 || http2]
Null/Loopback
    Family: IP (2)
Internet Protocol Version 4, Src: 127.0.0.1, Dst: 127.0.0.1
    0100 .... = Version: 4
    .... 0101 = Header Length: 20 bytes (5)
    Differentiated Services Field: 0x00 (DSCP: CS0, ECN: Not-ECT)
        0000 00.. = Differentiated Services Codepoint: Default (0)
        .... ..00 = Explicit Congestion Notification: Not ECN-Capable Transport (0)
    Total Length: 4964
    Identification: 0x0536 (1334)
    010. .... = Flags: 0x2, Don't fragment
        0... .... = Reserved bit: Not set
        .1.. .... = Don't fragment: Set
        ..0. .... = More fragments: Not set
    ...0 0000 0000 0000 = Fragment Offset: 0
    Time to Live: 128
    Protocol: TCP (6)
    Header Checksum: 0x0000 [validation disabled]
    [Header checksum status: Unverified]
    Source Address: 127.0.0.1
    Destination Address: 127.0.0.1
Transmission Control Protocol, Src Port: 10001, Dst Port: 50966, Seq: 1, Ack: 649, Len: 4924
    Source Port: 10001
    Destination Port: 50966
    [Stream index: 11]
    [Conversation completeness: Incomplete, DATA (15)]
    [TCP Segment Len: 4924]
    Sequence Number: 1    (relative sequence number)
    Sequence Number (raw): 3670947607
    [Next Sequence Number: 4925    (relative sequence number)]
    Acknowledgment Number: 649    (relative ack number)
    Acknowledgment number (raw): 3163440087
    0101 .... = Header Length: 20 bytes (5)
    Flags: 0x018 (PSH, ACK)
        000. .... .... = Reserved: Not set
        ...0 .... .... = Accurate ECN: Not set
        .... 0... .... = Congestion Window Reduced: Not set
        .... .0.. .... = ECN-Echo: Not set
        .... ..0. .... = Urgent: Not set
        .... ...1 .... = Acknowledgment: Set
        .... .... 1... = Push: Set
        .... .... .0.. = Reset: Not set
        .... .... ..0. = Syn: Not set
        .... .... ...0 = Fin: Not set
        [TCP Flags: ·······AP···]
    Window: 8440
    [Calculated window size: 2160640]
    [Window size scaling factor: 256]
    Checksum: 0x31e6 [unverified]
    [Checksum Status: Unverified]
    Urgent Pointer: 0
    [Timestamps]
        [Time since first frame in this TCP stream: 0.085869000 seconds]
        [Time since previous frame in this TCP stream: 0.085274000 seconds]
    [SEQ/ACK analysis]
        [iRTT: 0.000112000 seconds]
        [Bytes in flight: 4924]
        [Bytes sent since last PSH flag: 4924]
    TCP payload (4924 bytes)
Hypertext Transfer Protocol
    HTTP/1.1 200 OK\r\n
        [Expert Info (Chat/Sequence): HTTP/1.1 200 OK\r\n]
            [HTTP/1.1 200 OK\r\n]
            [Severity level: Chat]
            [Group: Sequence]
        Response Version: HTTP/1.1
        Status Code: 200
        [Status Code Description: OK]
        Response Phrase: OK
    Referrer-Policy: no-referrer\r\n
    X-Frame-Options: SAMEORIGIN\r\n
    Strict-Transport-Security: max-age=31536000; includeSubDomains\r\n
    X-Robots-Tag: none\r\n
    Cache-Control: no-store, must-revalidate, max-age=0\r\n
